{
  "clip_id": 77,
  "summary": "Девушка вспоминает бедное детство в Сибири: донашивала чужие вещи, ходила зимой в кроссовках, бесплатно занималась конным спортом; рассказывает, как проработала финансовые травмы.",
  "tags": [
    {
      "name": "детство",
      "source": "auto"
    },
    {
      "name": "бедность",
      "source": "auto"
    },
    {
      "name": "деньги",
      "source": "auto"
    },
    {
      "name": "конный спорт",
      "source": "auto"
    },
    {
      "name": "пересмотреть",
      "source": "user"
    }
  ],
  "topic_id": 3
}